{
  "definitions": {},
  "$schema": "http://json-schema.org/draft-07/schema#",
  "$id": "http://example.com/root.json",
  "type": "array",
  "title": "The Root Schema",
  "items": {
    "$id": "#/items",
    "type": "object",
    "title": "The Items Schema",
    "required": [
      "tariffNo",
      "name",
      "operatorName",
      "payroll",
      "callPrices",
      "smsPrice",
      "parameters"
    ],
    "properties": {
      "tariffNo": {
        "$id": "#/items/properties/tariffNo",
        "type": "integer",
        "title": "The TariffNo Schema"
      },
      "name": {
        "$id": "#/items/properties/name",
        "type": "string",
        "title": "The Name Schema"
      },
      "operatorName": {
        "$id": "#/items/properties/operatorName",
        "type": "string",
        "title": "The Operatorname Schema"
      },
      "payroll": {
        "$id": "#/items/properties/payroll",
        "type": "number",
        "title": "The Payroll Schema",
        "default": 0.0,
        "minimum": 0.0
      },
      "callPrices": {
        "$id": "#/items/properties/callPrices",
        "type": "object",
        "title": "The Callprices Schema",
        "required": [
          "inside",
          "outside",
          "landlinePhone"
        ],
        "properties": {
          "inside": {
            "$id": "#/items/properties/callPrices/properties/inside",
            "type": "integer",
            "title": "The Inside Schema",
            "default": 0,
            "minimum": 0.0,
            "maximum": 100.0
          },
          "outside": {
            "$id": "#/items/properties/callPrices/properties/outside",
            "type": "integer",
            "title": "The Outside Schema",
            "default": 0,
            "minimum": 0.0,
            "maximum": 100.0
          },
          "landlinePhone": {
            "$id": "#/items/properties/callPrices/properties/landlinePhone",
            "type": "integer",
            "title": "The Landlinephone Schema",
            "default": 0,
            "minimum": 0.0,
            "maximum": 100.0
          }
        }
      },
      "smsPrice": {
        "$id": "#/items/properties/smsPrice",
        "type": "integer",
        "title": "The Smsprice Schema",
        "default": 0,
        "minimum": 0.0,
        "maximum": 100.0
      },
      "parameters": {
        "$id": "#/items/properties/parameters",
        "type": "object",
        "title": "The Parameters Schema",
        "required": [
          "favoriteNumbers",
          "tariffing",
          "connectionPayment"
        ],
        "properties": {
          "favoriteNumbers": {
            "$id": "#/items/properties/parameters/properties/favoriteNumbers",
            "type": "integer",
            "title": "The Favoritenumbers Schema",
            "default": 0,
            "minimum": 0.0
          },
          "tariffing": {
            "$id": "#/items/properties/parameters/properties/tariffing",
            "type": "string",
            "enum": [
              "PER_1_MINUTE",
              "PER_15_SECONDS"
            ],
            "title": "The Tariffing Schema",
            "examples": [
              "PER_1_MINUTE",
              "PER_15_SECONDS"
            ]
          },
          "connectionPayment": {
            "$id": "#/items/properties/parameters/properties/connectionPayment",
            "type": "number",
            "title": "The Connectionpayment Schema",
            "default": 0.0,
            "minimum": 0.0
          }
        }
      }
    }
  }
}

