[
  {
    "tariffNo": 3,
    "name": "Bomba",
    "operatorName": "Lifecell",
    "payroll": 100.0,
    "callPrices": {
      "inside": 0,
      "outside": 50,
      "landlinePhone": 50
    },
    "smsPrice": 49,
    "parameters": {
      "favoriteNumbers": 4,
      "tariffing": "PER_15_SECONDS",
      "connectionPayment": 0.0
    }
  },
  {
    "tariffNo": 2,
    "name": "4G Smart",
    "operatorName": "Vodafone",
    "payroll": 150.0,
    "callPrices": {
      "inside": 10,
      "outside": 80,
      "landlinePhone": 99
    },
    "smsPrice": 50,
    "parameters": {
      "favoriteNumbers": 1,
      "tariffing": "PER_1_MINUTE",
      "connectionPayment": 5.5
    }
  },
  {
    "tariffNo": 0,
    "name": "Super Unlim",
    "operatorName": "Kyivstar",
    "payroll": 250.0,
    "callPrices": {
      "inside": 0,
      "outside": 10,
      "landlinePhone": 20
    },
    "smsPrice": 15,
    "parameters": {
      "favoriteNumbers": 5,
      "tariffing": "PER_1_MINUTE",
      "connectionPayment": 25.5
    }
  },
  {
    "tariffNo": 1,
    "name": "Super Net",
    "operatorName": "Kyivstar",
    "payroll": 300.0,
    "callPrices": {
      "inside": 0,
      "outside": 35,
      "landlinePhone": 45
    },
    "smsPrice": 20,
    "parameters": {
      "favoriteNumbers": 2,
      "tariffing": "PER_15_SECONDS",
      "connectionPayment": 14.99
    }
  },
  {
    "tariffNo": 4,
    "name": "Business",
    "operatorName": "Lifecell",
    "payroll": 350.0,
    "callPrices": {
      "inside": 0,
      "outside": 10,
      "landlinePhone": 10
    },
    "smsPrice": 25,
    "parameters": {
      "favoriteNumbers": 10,
      "tariffing": "PER_1_MINUTE",
      "connectionPayment": 10.0
    }
  }
]
